{
  "schemaVersion": 1,
  "version": "0.1.0-scaffold",
  "provenance": {
    "examples": "synthetic",
    "kinyarwanda": {
      "disclaimer": "Machine translation, not validated by a Kinyarwanda speaker / Traduction automatique, non validée par un locuteur",
      "mtModel": "facebook/nllb-200-distilled-600M",
      "similarityModel": "Xenova/paraphrase-multilingual-MiniLM-L12-v2 (onnx/model_quantized.onnx)",
      "ttsModel": "facebook/mms-tts-kin",
      "ttsLicense": "CC-BY-NC 4.0",
      "floresReference": {
        "metric": "chrF++ eng_Latn->kin_Latn, FLORES-200",
        "value": 44.0,
        "source": "https://dl.fbaipublicfiles.com/large_objects/nllb/models/nllb_200_dense_distill_600m/metrics.csv (linked as 'metrics' from https://huggingface.co/facebook/nllb-200-distilled-600M), row eng_Latn-kin_Latn,44",
        "otherDirections": {
          "kin_Latn->eng_Latn (same file)": 51.3,
          "fra_Latn->kin_Latn": "not published for the 600M model (the file lists only some directions); NLLB-200 MoE 54.5B reports 46.2 chrF++ (nllb_200_moe_54b/metrics.csv); our own measure on FLORES-200 devtest: catalog/flores-check.json"
        }
      },
      "acceptThreshold": 0.75,
      "scoring": "min(cos(source_fr, back_fr), cos(source_en, back_en)); back = kin→fra and kin→eng with the same NLLB model",
      "slotProtection": "numeric slots replaced by guard numbers {\"n\": \"17\", \"k\": \"13\", \"x\": \"14\", \"p\": \"15\"} before translation, required exactly once after, then restored; {finding} is never translated",
      "audioFormat": "mp3, mono, 16 kHz, 24 kbit/s; VITS seed 1234"
    }
  },
  "languages": [
    "en",
    "fr",
    "de",
    "es"
  ],
  "findings": [
    {
      "id": "P1",
      "labels": {
        "fr": "Accueil chaleureux",
        "en": "Warm welcome"
      },
      "polarity": "positive",
      "examples": {
        "en": [
          "Noor welcomed us so warmly.",
          "We felt really welcome from the moment we arrived.",
          "Such a kind and friendly host, she greeted us like family.",
          "The welcome was lovely, everyone was smiling.",
          "Thank you for the warm hospitality.",
          "Honestly the people were so nice to us, we felt at home right away.",
          "great welcome!!",
          "The family received us with so much kindness, it really touched us.",
          "Very friendly reception at the farm."
        ],
        "fr": [
          "Noor nous a accueillis très chaleureusement.",
          "On s'est sentis bienvenus dès notre arrivée.",
          "Un accueil adorable, toute la famille souriait.",
          "Merci pour votre gentillesse et votre hospitalité.",
          "L'hôte était vraiment accueillante, on se sentait comme à la maison.",
          "super accueil",
          "La famille nous a reçus avec beaucoup de chaleur, ça nous a touchés.",
          "Des gens très gentils et très accueillants.",
          "On a été reçus comme des amis, c'était très chaleureux."
        ],
        "de": [
          "Noor hat uns sehr herzlich empfangen.",
          "Wir haben uns vom ersten Moment an willkommen gefühlt.",
          "Die Familie war unglaublich gastfreundlich.",
          "Ein so warmherziger Empfang, alle haben gelächelt.",
          "Danke für die tolle Gastfreundschaft.",
          "Sehr freundliche Gastgeberin, wir fühlten uns wie zu Hause.",
          "herzlicher empfang!",
          "Man hat uns wie Freunde aufgenommen, das hat uns wirklich berührt.",
          "Die Leute auf der Farm waren total nett zu uns."
        ],
        "es": [
          "Noor nos recibió con muchísimo cariño.",
          "Nos sentimos bienvenidos desde que llegamos.",
          "Una acogida muy cálida, toda la familia sonriendo.",
          "Gracias por la hospitalidad, fueron muy amables.",
          "La anfitriona fue encantadora, nos sentimos como en casa.",
          "muy buena acogida",
          "La familia nos recibió como amigos y eso nos emocionó.",
          "Gente muy amable y acogedora.",
          "El recibimiento fue precioso, muy cercano."
        ]
      },
      "examplesSynthetic": true,
      "keywords": {
        "en": [
          "welcome",
          "hospitality",
          "friendly",
          "kind",
          "warm",
          "host"
        ],
        "fr": [
          "accueil",
          "accueillant",
          "hospitalité",
          "chaleureu",
          "gentil",
          "bienvenu"
        ],
        "de": [
          "empfang",
          "empfangen",
          "gastfreundlich",
          "herzlich",
          "willkommen",
          "freundlich"
        ],
        "es": [
          "acogida",
          "recibi",
          "hospitalidad",
          "amable",
          "bienvenid",
          "cálid"
        ]
      },
      "kinyarwanda": {
        "rw": "Abashyitsi bumvaga bakiriwe neza.",
        "source": {
          "fr": "Les visiteurs ont été bien accueillis.",
          "en": "Visitors felt welcome."
        },
        "backTranslation": {
          "fr": "Les visiteurs ont été bien accueillis.",
          "en": "The visitors felt welcomed."
        },
        "similarity": 0.9806,
        "similarityDetail": {
          "fr": 1.0,
          "en": 0.9806
        },
        "translatedFrom": "en",
        "attempts": 1,
        "chosenAttempt": 1,
        "backTranslationCheck": "passed",
        "audio": "audio/finding-P1.mp3",
        "status": "machine_translated_unvalidated"
      }
    },
    {
      "id": "P2",
      "labels": {
        "fr": "Visite du champ et des caféiers intéressante",
        "en": "Interesting tour of the field and coffee trees"
      },
      "polarity": "positive",
      "examples": {
        "en": [
          "Walking through the coffee plants was fascinating.",
          "I loved seeing the coffee trees up close in the field.",
          "The tour of the plantation was really interesting.",
          "Seeing the red cherries on the bushes was amazing.",
          "The walk in the fields, the coffee on the slope, the beans and maize below, all very interesting.",
          "nice field tour",
          "We enjoyed the visit of the coffee plot a lot.",
          "It was great to see where the coffee actually grows.",
          "The part where we went among the coffee trees was my favourite."
        ],
        "fr": [
          "La balade au milieu des caféiers était passionnante.",
          "J'ai adoré voir les plants de café de près dans le champ.",
          "La visite de la plantation était vraiment intéressante.",
          "Voir les cerises rouges sur les caféiers, c'était génial.",
          "Le tour des champs, le café en haut et le maïs en bas, très intéressant.",
          "visite des champs top",
          "On a beaucoup aimé la visite de la parcelle de café.",
          "C'était super de voir où pousse vraiment le café.",
          "Le moment dans les caféiers, c'était mon préféré."
        ],
        "de": [
          "Der Rundgang durch die Kaffeepflanzen war faszinierend.",
          "Ich fand es toll, die Kaffeesträucher auf dem Feld aus der Nähe zu sehen.",
          "Die Führung über die Plantage war sehr interessant.",
          "Die roten Kaffeekirschen an den Sträuchern zu sehen war großartig.",
          "Der Gang über die Felder, oben der Kaffee, unten Mais und Bohnen, wirklich spannend.",
          "schöne feldführung",
          "Der Besuch im Kaffeegarten hat uns sehr gefallen.",
          "Es war super zu sehen, wo der Kaffee wirklich wächst.",
          "Der Teil zwischen den Kaffeebäumen war mein Lieblingsmoment."
        ],
        "es": [
          "El paseo entre los cafetos fue fascinante.",
          "Me encantó ver las plantas de café de cerca en el campo.",
          "La visita a la plantación fue muy interesante.",
          "Ver las cerezas rojas en los arbustos fue increíble.",
          "El recorrido por los campos, el café arriba y el maíz abajo, muy interesante.",
          "buen recorrido por el campo",
          "Nos gustó mucho visitar la parcela de café.",
          "Fue genial ver dónde crece de verdad el café.",
          "La parte entre los cafetales fue mi favorita."
        ]
      },
      "examplesSynthetic": true,
      "keywords": {
        "en": [
          "field",
          "plantation",
          "coffee trees",
          "coffee plants",
          "bushes",
          "plot"
        ],
        "fr": [
          "champ",
          "plantation",
          "caféier",
          "plants de café",
          "parcelle"
        ],
        "de": [
          "feld",
          "plantage",
          "kaffeesträuch",
          "kaffeepflanzen",
          "kaffeebäum",
          "kaffeegarten"
        ],
        "es": [
          "campo",
          "plantación",
          "cafeto",
          "cafetal",
          "plantas de café",
          "parcela"
        ]
      },
      "kinyarwanda": {
        "rw": "Abashyitsi bakundaga gusura umurima w'ikawa.",
        "source": {
          "fr": "La visite du champ de café a plu.",
          "en": "Visitors liked the visit of the coffee field."
        },
        "backTranslation": {
          "fr": "Les visiteurs se rendaient souvent dans les champs de café.",
          "en": "Guests often visited the coffee plantation."
        },
        "similarity": 0.8146,
        "similarityDetail": {
          "fr": 0.8146,
          "en": 0.8206
        },
        "translatedFrom": "en",
        "attempts": 1,
        "chosenAttempt": 1,
        "backTranslationCheck": "passed",
        "audio": "audio/finding-P2.mp3",
        "status": "machine_translated_unvalidated"
      }
    },
    {
      "id": "P3",
      "labels": {
        "fr": "Torréfaction ou dégustation appréciée",
        "en": "Roasting or tasting enjoyed"
      },
      "polarity": "positive",
      "examples": {
        "en": [
          "Roasting the beans ourselves was the highlight.",